{
  "id": "guided-ux-onboarding-checklist",
  "title": "M8 guided UX — onboarding wizard and dashboard checklist",
  "milestone": 8,
  "specRef": "docs/ux-simple-mode.md",
  "rfcSection": "M8 guided UX",
  "expected": {
    "onboardingSteps": ["business", "tax", "vat", "review"],
    "defaultLocale": "sv",
    "sekParsing": {
      "input": "48 000,50",
      "minorUnits": 4800050
    },
    "checklistOrderWhenBlocked": [
      "compliance",
      "vat-breached",
      "staged",
      "open-invoices",
      "year-end"
    ],
    "complianceGoldenScenarios": [
      "fa-skatt-salary-and-business",
      "vat-exempt-below-threshold",
      "vat-exempt-threshold-breach"
    ],
    "dashboardTourSteps": [
      "checklist",
      "sidebar",
      "spendable-cash",
      "backup",
      "rules",
      "tax-tasks"
    ],
    "simpleModeDefault": true,
    "simpleModeHiddenNav": ["ledger"],
    "simpleModeNavOrder": ["dashboard", "invoices", "documents", "vat", "yearEnd", "settings"],
    "simpleModeTaskLabels": {
      "sv": ["Översikt", "Fakturor", "Kvitton och utgifter", "Redovisa moms", "Avsluta året", "Inställningar"],
      "en": ["Overview", "Invoices", "Receipts & expenses", "Report VAT", "Close the year", "Settings"]
    },
    "criticalReviewActions": [
      "invoice_issue",
      "invoice_credit",
      "payment_reconciliation",
      "expense_post",
      "vat_approve",
      "year_end_approve"
    ],
    "calendarTaskOrder": ["overdue", "action_required", "upcoming", "prepared_external_submission_required", "date_unavailable"]
  },
  "sources": [
    "https://github.com/vomba/oppenbokforing/blob/main/docs/ux-simple-mode.md"
  ]
}
